{
  "schema_version": "forge.sandbox.policy.v1",
  "policy_id": "policy-11111111-1111-4111-8111-111111111111",
  "workspace_id": "ws-11111111-1111-4111-8111-111111111111",
  "filesystem": {
    "read_mode": "backend_default_with_protected_paths",
    "read_roots": [
      "/opt/forge-tools"
    ],
    "write_roots": [
      "/tmp/forge-fixture/workspace"
    ],
    "protected_paths": [
      "/tmp/forge-fixture/synthetic-secrets"
    ],
    "deny_overrides_allow": true,
    "reject_unsafe_links": true
  },
  "network": {
    "mode": "deny_direct",
    "allowed_domains": [],
    "dns_isolation_required": false
  },
  "limits": {
    "memory_bytes": null,
    "disk_bytes": null,
    "pids": null,
    "wall_time_seconds": 300,
    "command_output_bytes": 1048576,
    "session_artifact_bytes": 16777216
  },
  "environment_keys": [
    "PATH"
  ],
  "fallback": "deny",
  "session_mutation": "replace_session"
}
